2026-02-20 03:52: ================================================================================
2026-02-20 03:52: Physics-Integrated GCN for WDS State Estimation
2026-02-20 03:52: ================================================================================
2026-02-20 03:52: TensorFlow version: 2.20.0
2026-02-20 03:52: Result directory: results/20260220_035240
2026-02-20 03:52: Data directory: datasets/asnet2_5/
2026-02-20 03:52: Learning mode: Unsupervised (Physics-based)
2026-02-20 03:52: 
2026-02-20 03:52: Configuration saved to: results/20260220_035240/config.json
2026-02-20 03:52: 
================================================================================
2026-02-20 03:52: TRAINING MODE
2026-02-20 03:52: ================================================================================
2026-02-20 03:52: 
Hyperparameters:
2026-02-20 03:52: ----------------------------------------
2026-02-20 03:52:   Latent dimension: 20
2026-02-20 03:52:   Hidden layers: 2
2026-02-20 03:52:   Correction updates: 20
2026-02-20 03:52:   Alpha (step size): 0.5
2026-02-20 03:52:   Learning rate: 0.001
2026-02-20 03:52:   Batch size: 500
2026-02-20 03:52:   Discount factor: 0.9
2026-02-20 03:52:   Non-linearity: leaky_relu
2026-02-20 03:52:   Max iterations: 80000
2026-02-20 03:52:   Learning mode: Unsupervised (Physics-based)
2026-02-20 03:52: 
2026-02-20 03:52: 
Model Configuration:
2026-02-20 03:52: ----------------------------------------
2026-02-20 03:52:   Name: physics_gcn
2026-02-20 03:52:   Directory: results/20260220_035240
2026-02-20 03:52:   Latent dimension: 20
2026-02-20 03:52:   Hidden layers: 2
2026-02-20 03:52:   Correction updates: 20
2026-02-20 03:52:   Alpha: 0.5
2026-02-20 03:52:   Non-linearity: leaky_relu
2026-02-20 03:52:   Batch size: 500
2026-02-20 03:52:   Learning mode: Unsupervised
2026-02-20 03:52:   d_in_A: 1
2026-02-20 03:52:   d_in_B: 4
2026-02-20 03:52:   d_out: 1
2026-02-20 03:52: Starting training...

2026-02-20 03:52: ================================================================================
2026-02-20 03:52: Starting Training
2026-02-20 03:52: ================================================================================
2026-02-20 03:52: Max iterations: 80000
2026-02-20 03:52: Learning rate: 0.001
2026-02-20 03:52: Discount: 0.9
2026-02-20 03:52: Data directory: datasets/asnet2_5/
2026-02-20 03:52: Training mode: Unsupervised
2026-02-20 03:54: 
Iteration 0:
2026-02-20 03:54:   Train loss: 0.748384
2026-02-20 03:54:   Val loss: 0.457477
2026-02-20 03:54: Model saved to: results/20260220_035240
2026-02-20 03:59: 
Iteration 1000:
2026-02-20 03:59:   Train loss: 0.007653
2026-02-20 03:59:   Val loss: 0.001697
2026-02-20 03:59: Model saved to: results/20260220_035240
2026-02-20 04:04: 
Iteration 2000:
2026-02-20 04:04:   Train loss: 0.001609
2026-02-20 04:04:   Val loss: 0.001317
2026-02-20 04:04: Model saved to: results/20260220_035240
2026-02-20 04:10: 
Iteration 3000:
2026-02-20 04:10:   Train loss: 0.001048
2026-02-20 04:10:   Val loss: 0.000683
2026-02-20 04:10: Model saved to: results/20260220_035240
2026-02-20 04:15: 
Iteration 4000:
2026-02-20 04:15:   Train loss: 0.000756
2026-02-20 04:15:   Val loss: 0.000887
2026-02-20 04:16: Model saved to: results/20260220_035240
2026-02-20 04:21: 
Iteration 5000:
2026-02-20 04:21:   Train loss: 0.000492
2026-02-20 04:21:   Val loss: 0.000371
2026-02-20 04:21: Model saved to: results/20260220_035240
2026-02-20 04:21: Checkpoint saved at iteration 5000
2026-02-20 04:27: 
Iteration 6000:
2026-02-20 04:27:   Train loss: 0.000422
2026-02-20 04:27:   Val loss: 0.000316
2026-02-20 04:27: Model saved to: results/20260220_035240
2026-02-20 04:33: 
Iteration 7000:
2026-02-20 04:33:   Train loss: 0.000371
2026-02-20 04:33:   Val loss: 0.000180
2026-02-20 04:33: Model saved to: results/20260220_035240
2026-02-20 04:38: 
Iteration 8000:
2026-02-20 04:38:   Train loss: 0.000330
2026-02-20 04:38:   Val loss: 0.000200
2026-02-20 04:38: Model saved to: results/20260220_035240
2026-02-20 04:43: 
Iteration 9000:
2026-02-20 04:43:   Train loss: 0.000292
2026-02-20 04:43:   Val loss: 0.000242
2026-02-20 04:43: Model saved to: results/20260220_035240
2026-02-20 04:46: 
Iteration 10000:
2026-02-20 04:46:   Train loss: 0.000270
2026-02-20 04:46:   Val loss: 0.000231
2026-02-20 04:46: Model saved to: results/20260220_035240
2026-02-20 04:46: Checkpoint saved at iteration 10000
2026-02-20 04:49: 
Iteration 11000:
2026-02-20 04:49:   Train loss: 0.000242
2026-02-20 04:49:   Val loss: 0.000352
2026-02-20 04:49: Model saved to: results/20260220_035240
2026-02-20 04:52: 
Iteration 12000:
2026-02-20 04:52:   Train loss: 0.000224
2026-02-20 04:52:   Val loss: 0.000376
2026-02-20 04:52: Model saved to: results/20260220_035240
2026-02-20 04:56: 
Iteration 13000:
2026-02-20 04:56:   Train loss: 0.000198
2026-02-20 04:56:   Val loss: 0.000098
2026-02-20 04:56: Model saved to: results/20260220_035240
2026-02-20 04:59: 
Iteration 14000:
2026-02-20 04:59:   Train loss: 0.000188
2026-02-20 04:59:   Val loss: 0.000130
2026-02-20 04:59: Model saved to: results/20260220_035240
2026-02-20 05:02: 
Iteration 15000:
2026-02-20 05:02:   Train loss: 0.000164
2026-02-20 05:02:   Val loss: 0.000169
2026-02-20 05:02: Model saved to: results/20260220_035240
2026-02-20 05:02: Checkpoint saved at iteration 15000
2026-02-20 05:05: 
Iteration 16000:
2026-02-20 05:05:   Train loss: 0.000155
2026-02-20 05:05:   Val loss: 0.000142
2026-02-20 05:05: Model saved to: results/20260220_035240
2026-02-20 05:09: 
Iteration 17000:
2026-02-20 05:09:   Train loss: 0.000143
2026-02-20 05:09:   Val loss: 0.000080
2026-02-20 05:09: Model saved to: results/20260220_035240
2026-02-20 05:12: 
Iteration 18000:
2026-02-20 05:12:   Train loss: 0.000132
2026-02-20 05:12:   Val loss: 0.000106
2026-02-20 05:12: Model saved to: results/20260220_035240
2026-02-20 05:15: 
Iteration 19000:
2026-02-20 05:15:   Train loss: 0.000117
2026-02-20 05:15:   Val loss: 0.000123
2026-02-20 05:15: Model saved to: results/20260220_035240
2026-02-20 05:18: 
Iteration 20000:
2026-02-20 05:18:   Train loss: 0.000110
2026-02-20 05:18:   Val loss: 0.000082
2026-02-20 05:18: Model saved to: results/20260220_035240
2026-02-20 05:18: Checkpoint saved at iteration 20000
2026-02-20 05:21: 
Iteration 21000:
2026-02-20 05:21:   Train loss: 0.000099
2026-02-20 05:21:   Val loss: 0.000142
2026-02-20 05:21: Model saved to: results/20260220_035240
2026-02-20 05:24: 
Iteration 22000:
2026-02-20 05:24:   Train loss: 0.000095
2026-02-20 05:24:   Val loss: 0.000045
2026-02-20 05:24: Model saved to: results/20260220_035240
2026-02-20 05:28: 
Iteration 23000:
2026-02-20 05:28:   Train loss: 0.000081
2026-02-20 05:28:   Val loss: 0.000049
2026-02-20 05:28: Model saved to: results/20260220_035240
2026-02-20 05:31: 
Iteration 24000:
2026-02-20 05:31:   Train loss: 0.000077
2026-02-20 05:31:   Val loss: 0.000072
2026-02-20 05:31: Model saved to: results/20260220_035240
2026-02-20 05:34: 
Iteration 25000:
2026-02-20 05:34:   Train loss: 0.000071
2026-02-20 05:34:   Val loss: 0.000036
2026-02-20 05:34: Model saved to: results/20260220_035240
2026-02-20 05:34: Checkpoint saved at iteration 25000
2026-02-20 05:37: 
Iteration 26000:
2026-02-20 05:37:   Train loss: 0.000064
2026-02-20 05:37:   Val loss: 0.000057
2026-02-20 05:37: Model saved to: results/20260220_035240
2026-02-20 05:40: 
Iteration 27000:
2026-02-20 05:40:   Train loss: 0.000062
2026-02-20 05:40:   Val loss: 0.000051
2026-02-20 05:40: Model saved to: results/20260220_035240
2026-02-20 05:44: 
Iteration 28000:
2026-02-20 05:44:   Train loss: 0.000056
2026-02-20 05:44:   Val loss: 0.000062
2026-02-20 05:44: Model saved to: results/20260220_035240
2026-02-20 05:47: 
Iteration 29000:
2026-02-20 05:47:   Train loss: 0.000052
2026-02-20 05:47:   Val loss: 0.000031
2026-02-20 05:47: Model saved to: results/20260220_035240
2026-02-20 05:50: 
Iteration 30000:
2026-02-20 05:50:   Train loss: 0.000051
2026-02-20 05:50:   Val loss: 0.000031
2026-02-20 05:50: Model saved to: results/20260220_035240
2026-02-20 05:50: Checkpoint saved at iteration 30000
2026-02-20 05:53: 
Iteration 31000:
2026-02-20 05:53:   Train loss: 0.000047
2026-02-20 05:53:   Val loss: 0.000028
2026-02-20 05:53: Model saved to: results/20260220_035240
2026-02-20 05:56: 
Iteration 32000:
2026-02-20 05:56:   Train loss: 0.000046
2026-02-20 05:56:   Val loss: 0.000131
2026-02-20 05:56: Model saved to: results/20260220_035240
2026-02-20 05:59: 
Iteration 33000:
2026-02-20 05:59:   Train loss: 0.000043
2026-02-20 05:59:   Val loss: 0.000045
2026-02-20 06:00: Model saved to: results/20260220_035240
2026-02-20 06:03: 
Iteration 34000:
2026-02-20 06:03:   Train loss: 0.000041
2026-02-20 06:03:   Val loss: 0.000035
2026-02-20 06:03: Model saved to: results/20260220_035240
2026-02-20 06:06: 
Iteration 35000:
2026-02-20 06:06:   Train loss: 0.000039
2026-02-20 06:06:   Val loss: 0.000029
2026-02-20 06:06: Model saved to: results/20260220_035240
2026-02-20 06:06: Checkpoint saved at iteration 35000
2026-02-20 06:09: 
Iteration 36000:
2026-02-20 06:09:   Train loss: 0.000038
2026-02-20 06:09:   Val loss: 0.000016
2026-02-20 06:09: Model saved to: results/20260220_035240
2026-02-20 06:12: 
Iteration 37000:
2026-02-20 06:12:   Train loss: 0.000035
2026-02-20 06:12:   Val loss: 0.000046
2026-02-20 06:12: Model saved to: results/20260220_035240
2026-02-20 06:15: 
Iteration 38000:
2026-02-20 06:15:   Train loss: 0.000035
2026-02-20 06:15:   Val loss: 0.000037
2026-02-20 06:15: Model saved to: results/20260220_035240
2026-02-20 06:19: 
Iteration 39000:
2026-02-20 06:19:   Train loss: 0.000034
2026-02-20 06:19:   Val loss: 0.000026
2026-02-20 06:19: Model saved to: results/20260220_035240
2026-02-20 06:22: 
Iteration 40000:
2026-02-20 06:22:   Train loss: 0.000033
2026-02-20 06:22:   Val loss: 0.000036
2026-02-20 06:22: Model saved to: results/20260220_035240
2026-02-20 06:22: Checkpoint saved at iteration 40000
2026-02-20 06:25: 
Iteration 41000:
2026-02-20 06:25:   Train loss: 0.000033
2026-02-20 06:25:   Val loss: 0.000030
2026-02-20 06:25: Model saved to: results/20260220_035240
2026-02-20 06:28: 
Iteration 42000:
2026-02-20 06:28:   Train loss: 0.000030
2026-02-20 06:28:   Val loss: 0.000032
2026-02-20 06:28: Model saved to: results/20260220_035240
2026-02-20 06:31: 
Iteration 43000:
2026-02-20 06:31:   Train loss: 0.000030
2026-02-20 06:31:   Val loss: 0.000048
2026-02-20 06:31: Model saved to: results/20260220_035240
2026-02-20 06:34: 
Iteration 44000:
2026-02-20 06:34:   Train loss: 0.000030
2026-02-20 06:34:   Val loss: 0.000022
2026-02-20 06:34: Model saved to: results/20260220_035240
2026-02-20 06:38: 
Iteration 45000:
2026-02-20 06:38:   Train loss: 0.000028
2026-02-20 06:38:   Val loss: 0.000021
2026-02-20 06:38: Model saved to: results/20260220_035240
2026-02-20 06:38: Checkpoint saved at iteration 45000
2026-02-20 06:41: 
Iteration 46000:
2026-02-20 06:41:   Train loss: 0.000028
2026-02-20 06:41:   Val loss: 0.000061
2026-02-20 06:41: Model saved to: results/20260220_035240
2026-02-20 06:44: 
Iteration 47000:
2026-02-20 06:44:   Train loss: 0.000026
2026-02-20 06:44:   Val loss: 0.000036
2026-02-20 06:44: Model saved to: results/20260220_035240
2026-02-20 06:47: 
Iteration 48000:
2026-02-20 06:47:   Train loss: 0.000026
2026-02-20 06:47:   Val loss: 0.000049
2026-02-20 06:47: Model saved to: results/20260220_035240
2026-02-20 06:50: 
Iteration 49000:
2026-02-20 06:50:   Train loss: 0.000025
2026-02-20 06:50:   Val loss: 0.000029
2026-02-20 06:50: Model saved to: results/20260220_035240
2026-02-20 06:54: 
Iteration 50000:
2026-02-20 06:54:   Train loss: 0.000024
2026-02-20 06:54:   Val loss: 0.000024
2026-02-20 06:54: Model saved to: results/20260220_035240
2026-02-20 06:54: Checkpoint saved at iteration 50000
2026-02-20 06:57: 
Iteration 51000:
2026-02-20 06:57:   Train loss: 0.000024
2026-02-20 06:57:   Val loss: 0.000028
2026-02-20 06:57: Model saved to: results/20260220_035240
2026-02-20 07:00: 
Iteration 52000:
2026-02-20 07:00:   Train loss: 0.000024
2026-02-20 07:00:   Val loss: 0.000020
2026-02-20 07:00: Model saved to: results/20260220_035240
2026-02-20 07:03: 
Iteration 53000:
2026-02-20 07:03:   Train loss: 0.000023
2026-02-20 07:03:   Val loss: 0.000057
2026-02-20 07:03: Model saved to: results/20260220_035240
2026-02-20 07:06: 
Iteration 54000:
2026-02-20 07:06:   Train loss: 0.000022
2026-02-20 07:06:   Val loss: 0.000012
2026-02-20 07:06: Model saved to: results/20260220_035240
2026-02-20 07:09: 
Iteration 55000:
2026-02-20 07:09:   Train loss: 0.000022
2026-02-20 07:09:   Val loss: 0.000027
2026-02-20 07:09: Model saved to: results/20260220_035240
2026-02-20 07:10: Checkpoint saved at iteration 55000
2026-02-20 07:13: 
Iteration 56000:
2026-02-20 07:13:   Train loss: 0.000021
2026-02-20 07:13:   Val loss: 0.000019
2026-02-20 07:13: Model saved to: results/20260220_035240
2026-02-20 07:16: 
Iteration 57000:
2026-02-20 07:16:   Train loss: 0.000021
2026-02-20 07:16:   Val loss: 0.000020
2026-02-20 07:16: Model saved to: results/20260220_035240
2026-02-20 07:19: 
Iteration 58000:
2026-02-20 07:19:   Train loss: 0.000021
2026-02-20 07:19:   Val loss: 0.000032
2026-02-20 07:19: Model saved to: results/20260220_035240
2026-02-20 07:22: 
Iteration 59000:
2026-02-20 07:22:   Train loss: 0.000020
2026-02-20 07:22:   Val loss: 0.000020
2026-02-20 07:22: Model saved to: results/20260220_035240
2026-02-20 07:25: 
Iteration 60000:
2026-02-20 07:25:   Train loss: 0.000019
2026-02-20 07:25:   Val loss: 0.000008
2026-02-20 07:26: Model saved to: results/20260220_035240
2026-02-20 07:26: Checkpoint saved at iteration 60000
2026-02-20 07:29: 
Iteration 61000:
2026-02-20 07:29:   Train loss: 0.000019
2026-02-20 07:29:   Val loss: 0.000011
2026-02-20 07:29: Model saved to: results/20260220_035240
2026-02-20 07:32: 
Iteration 62000:
2026-02-20 07:32:   Train loss: 0.000019
2026-02-20 07:32:   Val loss: 0.000016
2026-02-20 07:32: Model saved to: results/20260220_035240
2026-02-20 07:35: 
Iteration 63000:
2026-02-20 07:35:   Train loss: 0.000018
2026-02-20 07:35:   Val loss: 0.000043
2026-02-20 07:35: Model saved to: results/20260220_035240
2026-02-20 07:38: 
Iteration 64000:
2026-02-20 07:38:   Train loss: 0.000019
2026-02-20 07:38:   Val loss: 0.000011
2026-02-20 07:38: Model saved to: results/20260220_035240
2026-02-20 07:41: 
Iteration 65000:
2026-02-20 07:41:   Train loss: 0.000018
2026-02-20 07:41:   Val loss: 0.000013
2026-02-20 07:41: Model saved to: results/20260220_035240
2026-02-20 07:41: Checkpoint saved at iteration 65000
2026-02-20 07:45: 
Iteration 66000:
2026-02-20 07:45:   Train loss: 0.000017
2026-02-20 07:45:   Val loss: 0.000011
2026-02-20 07:45: Model saved to: results/20260220_035240
2026-02-20 07:48: 
Iteration 67000:
2026-02-20 07:48:   Train loss: 0.000018
2026-02-20 07:48:   Val loss: 0.000029
2026-02-20 07:48: Model saved to: results/20260220_035240
2026-02-20 07:51: 
Iteration 68000:
2026-02-20 07:51:   Train loss: 0.000016
2026-02-20 07:51:   Val loss: 0.000019
2026-02-20 07:51: Model saved to: results/20260220_035240
2026-02-20 07:54: 
Iteration 69000:
2026-02-20 07:54:   Train loss: 0.000017
2026-02-20 07:54:   Val loss: 0.000023
2026-02-20 07:54: Model saved to: results/20260220_035240
2026-02-20 07:57: 
Iteration 70000:
2026-02-20 07:57:   Train loss: 0.000017
2026-02-20 07:57:   Val loss: 0.000009
2026-02-20 07:57: Model saved to: results/20260220_035240
2026-02-20 07:57: Checkpoint saved at iteration 70000
2026-02-20 08:01: 
Iteration 71000:
2026-02-20 08:01:   Train loss: 0.000016
2026-02-20 08:01:   Val loss: 0.000022
2026-02-20 08:01: Model saved to: results/20260220_035240
2026-02-20 08:04: 
Iteration 72000:
2026-02-20 08:04:   Train loss: 0.000017
2026-02-20 08:04:   Val loss: 0.000018
2026-02-20 08:04: Model saved to: results/20260220_035240
2026-02-20 08:07: 
Iteration 73000:
2026-02-20 08:07:   Train loss: 0.000016
2026-02-20 08:07:   Val loss: 0.000019
2026-02-20 08:07: Model saved to: results/20260220_035240
2026-02-20 08:10: 
Iteration 74000:
2026-02-20 08:10:   Train loss: 0.000016
2026-02-20 08:10:   Val loss: 0.000010
2026-02-20 08:10: Model saved to: results/20260220_035240
2026-02-20 08:13: 
Iteration 75000:
2026-02-20 08:13:   Train loss: 0.000016
2026-02-20 08:13:   Val loss: 0.000021
2026-02-20 08:13: Model saved to: results/20260220_035240
2026-02-20 08:13: Checkpoint saved at iteration 75000
2026-02-20 08:17: 
Iteration 76000:
2026-02-20 08:17:   Train loss: 0.000016
2026-02-20 08:17:   Val loss: 0.000025
2026-02-20 08:17: Model saved to: results/20260220_035240
2026-02-20 08:20: 
Iteration 77000:
2026-02-20 08:20:   Train loss: 0.000015
2026-02-20 08:20:   Val loss: 0.000025
2026-02-20 08:20: Model saved to: results/20260220_035240
2026-02-20 08:23: 
Iteration 78000:
2026-02-20 08:23:   Train loss: 0.000015
2026-02-20 08:23:   Val loss: 0.000011
2026-02-20 08:23: Model saved to: results/20260220_035240
2026-02-20 08:26: 
Iteration 79000:
2026-02-20 08:26:   Train loss: 0.000015
2026-02-20 08:26:   Val loss: 0.000022
2026-02-20 08:26: Model saved to: results/20260220_035240
2026-02-20 08:29: 
Iteration 79999:
2026-02-20 08:29:   Train loss: 0.000014
2026-02-20 08:29:   Val loss: 0.000013
2026-02-20 08:29: Model saved to: results/20260220_035240
2026-02-20 08:29: Model saved to: results/20260220_035240
2026-02-20 08:29: 
Training completed!
2026-02-20 08:29: 
Training completed in 4.62 hours
2026-02-20 08:29: 
================================================================================
2026-02-20 08:29: VALIDATION EVALUATION
2026-02-20 08:29: ================================================================================
2026-02-20 08:29: 
Evaluating on val set...
2026-02-20 08:29: Predictions saved to: results/20260220_035240/predictions_val.npz
2026-02-20 08:29: Validation Results:
2026-02-20 08:29: ----------------------------------------
2026-02-20 08:29:   mse: 0.000034
2026-02-20 08:29:   rmse: 0.005815
2026-02-20 08:29:   mae: 0.004737
2026-02-20 08:29:   correlation: 0.999978
2026-02-20 08:29:   physics_loss: 0.000013
2026-02-20 08:29: 
================================================================================
2026-02-20 08:29: TEST EVALUATION
2026-02-20 08:29: ================================================================================
2026-02-20 08:29: 
Evaluating on test set...
2026-02-20 08:29: Predictions saved to: results/20260220_035240/predictions_test.npz
2026-02-20 08:29: Test Results:
2026-02-20 08:29: ----------------------------------------
2026-02-20 08:29:   mse: 0.000034
2026-02-20 08:29:   rmse: 0.005810
2026-02-20 08:29:   mae: 0.004733
2026-02-20 08:29:   correlation: 0.999978
2026-02-20 08:29:   physics_loss: 0.000013
2026-02-20 08:29: You are saving your model as an HDF5 file via `model.save()` or `keras.saving.save_model(model)`. This file format is considered legacy. We recommend using instead the native Keras format, e.g. `model.save('my_model.keras')` or `keras.saving.save_model(model, 'my_model.keras')`. 
2026-02-20 08:29: 
Final model saved to: results/20260220_035240/final_model.h5
2026-02-20 08:29: Metrics summary saved to: results/20260220_035240/metrics_summary.json
2026-02-20 08:29: 
================================================================================
2026-02-20 08:29: Done!
2026-02-20 08:29: ================================================================================
